{
	"$schema": "../../schemas/app-v2.schema.json",
	"id": "powr-testimonials",
	"chismografo": {
		"tipo": 1,
		"version": 1,
		"ultimaActualizacion": "2026-09-11",
		"revision": 0,
		"entorno": 0
	},
	"acercaDe": {
		"detallesGenerales": {
			"nombre": "POWR: Customer Testimonials",
			"desarrollador": "POWR",
			"web": "https://www.powr.io",
			"categoria": "Reseñas",
			"logo": {
				"id": "powr-testimonials.webp",
				"proveedor": "local"
			}
		},
		"cmsCompatibles": [
			{
				"id": "Shopify",
				"slug": "powr-testimonials",
				"enlace": "powr-testimonials"
			}
		],
		"precios": []
	},
	"herramienta": {
		"reglasDeteccion": [
			{
				"tipo": "script-src",
				"patron": "powr-testimonials|powr[_-]?testimonials",
				"descripcion": "Script o recurso de integración de POWR: Customer Testimonials detectado"
			}
		]
	}
}
