{
	"$schema": "../../schemas/app-v2.schema.json",
	"id": "way2enjoy-image-optimizer",
	"chismografo": {
		"tipo": 1,
		"version": 1,
		"ultimaActualizacion": "2026-09-11",
		"revision": 0,
		"entorno": 0
	},
	"acercaDe": {
		"detallesGenerales": {
			"nombre": "Way2Enjoy Image Optimizer",
			"desarrollador": "Way2Enjoy",
			"web": "https://apps.shopify.com/way2enjoy-image-optimizer",
			"categoria": "SEO",
			"logo": {
				"id": "way2enjoy-image-optimizer.webp",
				"proveedor": "local"
			}
		},
		"cmsCompatibles": [
			{
				"id": "Shopify",
				"slug": "way2enjoy-image-optimizer",
				"enlace": "way2enjoy-image-optimizer"
			}
		],
		"precios": []
	},
	"herramienta": {
		"reglasDeteccion": [
			{
				"tipo": "script-src",
				"patron": "way2enjoy-image-optimizer|way2enjoy[_-]?image[_-]?optimizer",
				"descripcion": "Script o recurso de integración de Way2Enjoy Image Optimizer detectado"
			}
		]
	}
}
