{
	"$schema": "../../schemas/app-v2.schema.json",
	"id": "printful",
	"chismografo": {
		"tipo": 1,
		"version": 1,
		"ultimaActualizacion": "2026-09-11",
		"revision": 0,
		"entorno": 0
	},
	"acercaDe": {
		"detallesGenerales": {
			"nombre": "Printful",
			"desarrollador": "Printful",
			"web": "https://www.printful.com",
			"categoria": "Impresión bajo Demanda",
			"logo": {
				"id": "printful.png",
				"proveedor": "local"
			}
		},
		"cmsCompatibles": [
			{
				"id": "Shopify",
				"slug": "printful",
				"enlace": "printful"
			}
		],
		"precios": []
	},
	"herramienta": {
		"reglasDeteccion": [
			{
				"tipo": "script-src",
				"patron": "printful\\.com",
				"descripcion": "Printful integration script or resource detected"
			}
		]
	}
}
