{
	"$schema": "../../schemas/app-v2.schema.json",
	"id": "judge-me",
	"chismografo": {
		"tipo": 1,
		"version": 1,
		"ultimaActualizacion": "2026-09-11",
		"revision": 0,
		"entorno": 0
	},
	"acercaDe": {
		"detallesGenerales": {
			"nombre": "Judge.me",
			"desarrollador": "Judge.me",
			"web": "https://www.judge.me",
			"categoria": "Reseñas",
			"logo": {
				"id": "judge-me.png",
				"proveedor": "local"
			}
		},
		"cmsCompatibles": [
			{
				"id": "shopify",
				"slug": "judge-me",
				"enlace": "judge-me"
			}
		],
		"precios": []
	},
	"herramienta": {
		"reglasDeteccion": [
			{
				"tipo": "script-src",
				"patron": "judgeme|judge\\.me",
				"descripcion": "Judge.me integration script or resource detected"
			}
		]
	}
}
