{
	"$schema": "../../schemas/app-v2.schema.json",
	"id": "shogun",
	"chismografo": {
		"tipo": 1,
		"version": 1,
		"ultimaActualizacion": "2026-09-11",
		"revision": 0,
		"entorno": 0
	},
	"acercaDe": {
		"detallesGenerales": {
			"nombre": "Shogun - Landing Page Builder",
			"desarrollador": "Shogun Labs Inc.",
			"web": "https://www.getshogun.com",
			"categoria": "Constructor de Páginas",
			"logo": {
				"id": "getshogun.com",
				"proveedor": "logodev"
			}
		},
		"cmsCompatibles": [
			{
				"id": "Shopify",
				"slug": "shogun",
				"enlace": "shogun"
			}
		],
		"precios": []
	},
	"herramienta": {
		"reglasDeteccion": [
			{
				"tipo": "script-src",
				"patron": "shogun",
				"descripcion": "Integración o recurso de Shogun detectado",
				"peso": 1
			}
		]
	}
}
