{
	"$schema": "../../schemas/app-v2.schema.json",
	"id": "frequently-bought-together",
	"chismografo": {
		"tipo": 1,
		"version": 1,
		"ultimaActualizacion": "2026-09-11",
		"revision": 0,
		"entorno": 0
	},
	"acercaDe": {
		"detallesGenerales": {
			"nombre": "Frequently Bought Together",
			"desarrollador": "Frequently Bought Together",
			"web": "https://www.frequently-bought-together.com",
			"categoria": "Checkout / Ofertas",
			"logo": {
				"id": "frequently-bought-together.com",
				"proveedor": "local"
			}
		},
		"cmsCompatibles": [
			{
				"id": "Shopify",
				"slug": "frequently-bought-together",
				"enlace": "frequently-bought-together"
			}
		],
		"precios": []
	},
	"herramienta": {
		"reglasDeteccion": [
			{
				"tipo": "script-src",
				"patron": "frequently-bought-together",
				"descripcion": "Frequently Bought Together integration script or resource detected"
			}
		]
	}
}
