{
	"$schema": "../../schemas/app-v2.schema.json",
	"id": "powr-pricing-table",
	"chismografo": {
		"tipo": 1,
		"version": 1,
		"ultimaActualizacion": "2026-09-11",
		"revision": 0,
		"entorno": 0
	},
	"acercaDe": {
		"detallesGenerales": {
			"nombre": "POWR: Pricing Table Comparison",
			"desarrollador": "POWR",
			"web": "https://www.powr.io",
			"categoria": "Checkout / Ofertas",
			"logo": {
				"id": "powr-pricing-table.webp",
				"proveedor": "local"
			}
		},
		"cmsCompatibles": [
			{
				"id": "Shopify",
				"slug": "powr-pricing-table",
				"enlace": "powr-pricing-table"
			}
		],
		"precios": []
	},
	"herramienta": {
		"reglasDeteccion": [
			{
				"tipo": "script-src",
				"patron": "powr-pricing-table|powr[_-]?pricing[_-]?table",
				"descripcion": "Script o recurso de integración de POWR: Pricing Table Comparison detectado"
			}
		]
	}
}
