{
	"$schema": "../../schemas/app-v2.schema.json",
	"id": "form-builder-contact-form",
	"chismografo": {
		"tipo": 1,
		"version": 1,
		"ultimaActualizacion": "2026-09-11",
		"revision": 0,
		"entorno": 0
	},
	"acercaDe": {
		"detallesGenerales": {
			"nombre": "Powerful Contact Form Builder",
			"desarrollador": "Powerful Contact Form Builder",
			"web": "https://powerfulform.com",
			"categoria": "Otros",
			"logo": {
				"id": "form-builder-contact-form",
				"proveedor": "local"
			}
		},
		"cmsCompatibles": [
			{
				"id": "shopify",
				"slug": "form-builder-contact-form",
				"enlace": "form-builder-contact-form"
			}
		],
		"precios": []
	},
	"herramienta": {
		"reglasDeteccion": [
			{
				"tipo": "script-src",
				"patron": "form-builder-contact-form|form[_-]?builder[_-]?contact[_-]?form|powerfulform",
				"descripcion": "Script o recurso de integración de Powerful Contact Form Builder detectado"
			}
		]
	}
}
