{
	"$schema": "../../schemas/app-v2.schema.json",
	"id": "tridentab",
	"chismografo": {
		"tipo": 1,
		"version": 1,
		"ultimaActualizacion": "2026-09-11",
		"revision": 0,
		"entorno": 0
	},
	"acercaDe": {
		"detallesGenerales": {
			"nombre": "A/B: Product and Price Testing",
			"desarrollador": "TridentAB",
			"web": "https://tridentab.com",
			"categoria": "A/B Testing / Optimización",
			"logo": {
				"id": "tridentab.com",
				"proveedor": "logodev"
			}
		},
		"cmsCompatibles": [
			{
				"id": "Shopify",
				"slug": "tridentab",
				"enlace": "tridentab"
			}
		],
		"precios": []
	},
	"herramienta": {
		"reglasDeteccion": [
			{
				"tipo": "script-src",
				"patron": "tridentab|trident-ab|trident_ab",
				"descripcion": "Script o recurso de integración de A/B Product and Price Testing detectado"
			}
		]
	}
}
