{
	"$schema": "../../schemas/app-v2.schema.json",
	"id": "privy",
	"chismografo": {
		"tipo": 1,
		"version": 1,
		"ultimaActualizacion": "2026-09-11",
		"revision": 0,
		"entorno": 0
	},
	"acercaDe": {
		"detallesGenerales": {
			"nombre": "Privy ‑ Email, SMS & Pop Ups",
			"desarrollador": "Privy",
			"web": "https://privy.com",
			"categoria": "Marketing / Popups",
			"logo": {
				"id": "privy.png",
				"proveedor": "local"
			}
		},
		"cmsCompatibles": [
			{
				"id": "Shopify",
				"slug": "privy",
				"enlace": "privy"
			}
		],
		"precios": []
	},
	"herramienta": {
		"reglasDeteccion": [
			{
				"tipo": "script-src",
				"patron": "privy|privi",
				"descripcion": "Script o recurso de integración de Privy ‑ Email, SMS & Pop Ups detectado"
			}
		]
	}
}
