{
	"$schema": "../../schemas/app-v2.schema.json",
	"id": "rivo",
	"chismografo": {
		"tipo": 1,
		"version": 1,
		"ultimaActualizacion": "2026-09-11",
		"revision": 0,
		"entorno": 0
	},
	"acercaDe": {
		"detallesGenerales": {
			"nombre": "Rivo: Loyalty Program, Rewards",
			"desarrollador": "Rivo",
			"web": "https://www.rivo.io",
			"categoria": "Fidelización / Lealtad",
			"logo": {
				"id": "rivo.png",
				"proveedor": "local"
			}
		},
		"cmsCompatibles": [
			{
				"id": "Shopify",
				"slug": "rivo-loyalty",
				"enlace": "rivo-loyalty"
			}
		],
		"precios": []
	},
	"herramienta": {
		"reglasDeteccion": [
			{
				"tipo": "script-src",
				"patron": "rivo\\.io|rivo-app",
				"descripcion": "Integración o recurso de Rivo detectado",
				"peso": 1
			}
		]
	}
}
